{
  "$schema": "https://json-schema.org/draft/2020-12/schema",
  "type": "object", "required": ["schemaVersion", "package", "version", "revision", "artifactSha256", "policySha256", "files"],
  "properties": {
    "schemaVersion": { "const": 1 }, "package": { "const": "@foss-earth/ci" }, "version": { "type": "string" },
    "revision": { "type": "string", "pattern": "^[a-f0-9]{40}$" },
    "artifactSha256": { "$ref": "#/$defs/digest" }, "policySha256": { "$ref": "#/$defs/digest" },
    "files": { "type": "object", "minProperties": 6, "additionalProperties": { "$ref": "#/$defs/digest" } }
  }, "$defs": { "digest": { "type": "string", "pattern": "^[a-f0-9]{64}$" } }
}
